title,brand,price,url,img,description,source,sold
Rolex Datejust 126300 - Mint Green 2022,Rolex,8995,https://www.watchclub.com/rolex/datejust-41/126300-mintgreen-ref-126300-year-2022-16316,https://www.watchclub.com/upload/watches/wb/watch-club-rolex-datejust-41-mintgreen-ref-126300-year-2022-1766246402000-16316-wb.png,"This brand new Datejust 41 (ref. 126300), with mint green sunray dial and Oyster bracelet, is the winning combination. Chromalight batons, powered by Rolex s updated self-winding calibre 3235, 70hr power reserve, and waterproof to 100m.Presented ...",Watch Club,False
Rolex Oyster Perpetual 1505 - Ricciardi 1974,Rolex,7500,https://www.watchclub.com/rolex/oyster-perpetual-date/1505-ricciardi-ref-1505-year-1974,https://www.watchclub.com/upload/watches/wb/watch-club-rolex-oyster-perpetual-date-1505-ricciardi-ref-1505-year-1974-1763379002492-16058-wb.png,"The go-to jeweller for Argentinian high society, Rolex timepieces retailed by Joyeria Ricciardi are a rare and prized find.This is our first Ricciardi retailed vintage Rolex, so what s all the ...",Watch Club,False
Rolex Explorer 6150 - Gilt Dial 1953,Rolex,25500,https://www.watchclub.com/rolex/explorer/6150-giltdial-ref-6150-year-1953,https://www.watchclub.com/upload/watches/wb/watch-club-rolex-explorer-6150-giltdial-ref-6150-year-1953-1760356802575-12697-wb.png,"The 6150 from 53 - the rarest and most important reference in Explorer history. The first Explorer model, produced in extremely low numbers in 1953 and bridging the Oyster Perpetual Pre-Explorer ...",Watch Club,False
Rolex Sea-Dweller 126600 - 50th Anniversary 2019,Rolex,10500,https://www.watchclub.com/rolex/sea-dweller/126600-50thanniversary-ref-126600-year-2019,https://www.watchclub.com/upload/watches/wb/watch-club-rolex-sea-dweller-126600-50thanniversary-ref-126600-year-2019-1759769111344-16207-wb.png,"This 50th anniversary red writing Sea-Dweller (ref. 126600) is not one to miss.The 43mm case (with patented helium escape valve) is made from specially developed 904L Oystersteel, which is highly ...",Watch Club,False
Rolex Sea-Dweller 1665 - Great White 1977,Rolex,12975,https://www.watchclub.com/rolex/sea-dweller/1665-greatwhite-ref-1665-year-1977-7983,https://www.watchclub.com/upload/watches/wb/watch-club-rolex-sea-dweller-1665-greatwhite-ref-1665-year-1977-7983-1759153502362-7983-wb.png,"In beautiful condition, this is the vintage Sea-Dweller ref. 1665 Great White with super-domed Plexiglas. From the first year of production (1977), this Mark I dial was the first all white print SD. Unmistakable ...",Watch Club,False
Omega Speedmaster 145.022 - Straight Writing 1970,Omega,6950,https://www.watchclub.com/omega/speedmaster/145022-straightwriting-ref-145022-69st-year-1970,https://www.watchclub.com/upload/watches/wb/watch-club-omega-speedmaster-145022-straightwriting-ref-145022-69st-year-1970-1757439003654-16120-wb.png,"From the moment of splashdown on the 24th of July 1969, the watch world had found an indelible hero: the Omega Speedmaster Professional. Everyone at Omega was abuzz. The Speedmaster Professional ...",Watch Club,False
Cartier Ballon Bleu W6920021 - White Gold 2013,Cartier,20500,https://www.watchclub.com/cartier/ballon-bleu/w6920021-whitegold-ref-w6920021-year-2013,https://www.watchclub.com/upload/watches/wb/watch-club-cartier-ballon-bleu-w6920021-whitegold-ref-w6920021-year-2010-1757331004781-16161-wb.png,A rare opportunity to acquire one of Cartier s most impressive complications for a fraction of its retail price. This is the haute horologerie 18ct white gold Ballon Bleu Flying Tourbillon. Its slate ...,Watch Club,False
Panerai Luminor Marina PAM 299 - Box & Certificate 2010,Panerai,4250,https://www.watchclub.com/panerai/luminor-marina/pam299-box-and-certificate-ref-pam00299-year-2010,https://www.watchclub.com/upload/watches/wb/watch-club-panerai-luminor-marina-pam299-box-and-certificate-ref-pam299-year-2010-1751473803035-16114-wb.png,"This is the Luminor Marina PAM 299, Panerai at its most wearable. Produced in stainless steel and fitted with its robust bracelet, this 44mm Luminor delivers both presence and practicality. ...",Watch Club,False
