title,brand,price,url,img,description,source,date,sold
Drake Take Care Rolex GMT-Master II Ref 116758SANR in 18K YG Unpolished Full Set,Rolex,500000,https://www.windvintage.com/ovo-drake-take-care-rolex-gmt-master-ii-ref-116758sanr-in-18k-yg-unpolished-full-set,https://images.squarespace-cdn.com/content/v1/5b213f95506fbec9b54e014c/1776703363093-YR480RK5SXLP5WXZTHG7/Image+32.jpeg,The Rolex GMT-Master II reference 116758SANR was introduced in circa 2006. These were among the most expensive offerings from the manufacturer and made in very limited production due to the extreme intricacy of gem setting. No other company creates gem set watches like Rolex. This is an internal artisanal department within Rolex which utilizes the highest-quality flawless diamonds which are hand-s,Wind Vintage,2026-04-19,False
Rolex GMT-Master II Pepsi 126710BLRO on Jubilee Full Set Unpolished,Rolex,27900,https://www.windvintage.com/rolex-gmtmaster-ii-pepsi-126710blro-on-jubilee-full-set-unpolished-copy,https://images.squarespace-cdn.com/content/v1/5b213f95506fbec9b54e014c/1776710528226-RYIIQVJHFNA4X4Q84TBM/Image+35.jpeg,"The Rolex “Pepsi” GMT-Master II reference 126710BLRO is one of the most sought-after modern sports watches today. It captures the iconic DNA from the models created for Pan Am pilots in the 1950s. Due to its incredible heritage and iconic look, it remains a flagship model for Rolex to this day. This example is in great condition. The case appears to be unpolished. It measures 40mm in diameter. The",Wind Vintage,2026-04-19,True
Rolex Day-Date 40 White Gold w/ Blue Dial Reference 228239 Full Set,Rolex,39900,https://www.windvintage.com/rolex-day-date-40-white-gold-w/-blue-dial-reference-228239-full-set,https://images.squarespace-cdn.com/content/v1/5b213f95506fbec9b54e014c/1776710572599-6A44R9WQSX1BFCY2BBTM/Image+36.jpeg,,Wind Vintage,2026-04-19,False
Rolex Oyster Perpetual Reference 67198 on Ladies Jubilee Link in 18K YG Unpolished,Rolex,19000,https://www.windvintage.com/rolex-oyster-perpetual-reference-67198-on-ladies-jubilee-link-in-18k-yg-unpolished,https://images.squarespace-cdn.com/content/v1/5b213f95506fbec9b54e014c/1776441798222-8O9MW8LBU5H2N13CY1GE/Image+28.jpeg,,Wind Vintage,2026-04-19,False
Rolex Lavender Dial Datejust Ref. 1600,Rolex,9500,https://www.windvintage.com/rolex-lavender-dial-datejust-ref-1600,https://images.squarespace-cdn.com/content/v1/5b213f95506fbec9b54e014c/1776441510148-8CY084LDJCWNH9T1PLKC/Image+25.jpeg,"The Datejust is an iconic watch introduced in 1945. This Datejust reference 1600 is defined by the smooth bezel. It has a beautiful lavender dial. The serial number dates the watch to circa 1969. It is paired on a Jubilee bracelet dating to circa 1969 as well. The watch has a crystal without cyclops that is attractive, giving it an Explorer-like look. The case appears to be lightly polished. The w",Wind Vintage,2026-04-19,False
Rolex Big Daytona Ref 6239 Unpolished,Rolex,79000,https://www.windvintage.com/rolex-big-daytona-ref-6239-unpolished,https://images.squarespace-cdn.com/content/v1/5b213f95506fbec9b54e014c/602b0981-4391-48d6-870e-1db70959d089/DSC05786.JPG,"The Rolex Daytona reference 6239 is the original and earliest reference of the Daytona. This example features a “Big Daytona” logo where DAYTONA is large and underneath COSMOGRAPH on the dial. I really love the way the ROLEX / COSMOGRAPH / DAYTONA text lines up in descending order like a pyramid in shape. This example also has the original early “300” Mark 2 reference 6239 bezel, which differs fro",Wind Vintage,2026-04-19,False
Rolex Daytona Pikachu Ref. 126518LN in 18k YG Full Set Unpolished,Rolex,60900,https://windvintage.com/rolex-daytona-pikachu-ref-126518ln-full-set-unpolished,https://images.squarespace-cdn.com/content/v1/5b213f95506fbec9b54e014c/4437a740-9d5e-4e90-a1b0-a6a73cb7662d/DSC03559.JPG,"The Oysterflex bracelet features an F size strap at 12 o’clock and a D size strap at 6 o’clock. We do not know the service history, but the watch is running well. It does not come with a box or papers. The watch comes as a “full set” with a box and papers. The watch was originally sold in 2026. It recently passed a water resistance test of 5 bar.",Wind Vintage,2026-04-19,True
Rolex Explorer I Silver Font Gilt Dial Reference 1016 Unpolished,Rolex,35000,https://www.windvintage.com/rolex-explorer-i-silver-font-gilt-dial-reference-1016-unpolished,https://images.squarespace-cdn.com/content/v1/5b213f95506fbec9b54e014c/f9f36a98-c5f9-4586-a366-bbe6654051f7/DSC03292.JPG,,Wind Vintage,2026-04-19,False
Rolex Explorer I Ref. 1016,Rolex,17900,https://www.windvintage.com/rolex-explorer-i-ref-10161-1-1,https://images.squarespace-cdn.com/content/v1/5b213f95506fbec9b54e014c/1775564757890-02SGT8ZWF544P92EPA9F/DSC08201.png,"The Rolex Explorer reference 1016 is one of the purest expressions of watch design, and it is for this reason that I am probably asked for vintage Explorer reference 1016s more than any other watch. This example dates to circa late 1966 with a 1.61M serial. It features a tritium matte dial. The watch may have originally been born with a gilt dial. The case is 36mm in diameter (43mm lug-to-lug). It",Wind Vintage,2026-04-19,False
"Rolex ""Pre-Daytona"" Chronograph Ref. 6238",Rolex,39000,https://www.windvintage.com/rolex-pre-daytona-chronograph-ref-6238,https://images.squarespace-cdn.com/content/v1/5b213f95506fbec9b54e014c/e327e7bd-1772-4f95-a174-1fea2ce9ba26/DSC00648.JPG,The Rolex “Pre-Daytona” reference 6238 is a great chronograph for Rolex enthusiasts. This example features a silver dial with a printed tachymeter scale. This particular example dates to circa 1965 with a 1.1M serial number. The case is 36mm in diameter and has been polished in the past. It is paired with a C+I bracelet dating to 1969. This watch does not come with a box and papers. We do not know,Wind Vintage,2026-04-19,False
Rolex Pre-Daytona Reference 6234,Rolex,45000,https://www.windvintage.com/rolex-pre-daytona-reference-6234,https://images.squarespace-cdn.com/content/v1/5b213f95506fbec9b54e014c/c37b2cb6-2ae8-467c-8cae-9b6ecf9eb748/DSC05817.JPG,,Wind Vintage,2026-04-19,False
Rolex Precision Ref. 4411 In 14k Rose Gold Unpolished,Rolex,14000,https://www.windvintage.com/rolex-precision-ref-4411-in-14k-rose-gold-unpolished,https://images.squarespace-cdn.com/content/v1/5b213f95506fbec9b54e014c/01b5d605-3f87-4a3b-a321-862d734f661e/DSC06505.JPG,,Wind Vintage,2026-04-19,False
Rolex Honeycomb Dial Oyster Perpetual Reference 6564 18K RG Unpolished,Rolex,19000,https://www.windvintage.com/rolex-honeycomb-dial-oyster-perpetual-6564-18k-yg,https://images.squarespace-cdn.com/content/v1/5b213f95506fbec9b54e014c/cb3e8656-e1d5-4f18-92c0-211c3a910686/DSC02477.JPG,,Wind Vintage,2026-04-19,False
Rolex Mk 4 GMT-Master Pepsi Matte Dial Ref. 1675,Rolex,17000,https://www.windvintage.com/rolex-mk-4-gmt-master-pepsi-matte-dial-ref-1675,https://images.squarespace-cdn.com/content/v1/5b213f95506fbec9b54e014c/b5a0b985-711c-4f85-85bd-72e228d46431/DSC06834.JPG,"The Rolex GMT- Master' video and corresponding article I produced. You can also read our comprehensive article ‘ Collector's Guide: The Rolex GMT-Master Reference 1675 In Steel . The watch does not come with a box or papers. We do not know the service history, but the watch is running well. It recently passed a water resistance test of 5 bar. ON HOLD: $17,000 (Item SBUXYT4973) ON HOLD #block-9834c",Wind Vintage,2026-04-19,False
Rolex GMT-Master II Coke Reference 16710 w/ CPO Card,Rolex,13900,https://www.windvintage.com/rolex-gmt-master-ii-coke-reference-16710-cpo,https://images.squarespace-cdn.com/content/v1/5b213f95506fbec9b54e014c/893b29dd-029a-4a30-82f6-abdd07fcb8f5/DSC03920.JPG,The Rolex GMT-Master ' video and read the corresponding article.,Wind Vintage,2026-04-19,False
Rolex GMT-Master Ref 16750,Rolex,11900,https://www.windvintage.com/rolex-gmt-master-ref-16750,https://images.squarespace-cdn.com/content/v1/5b213f95506fbec9b54e014c/5974d520-4024-4bfe-88d9-40898d50effa/DSC03758.JPG,"The Rolex GMT-Master reference 16750 was introduced in circa 1979 with a production run until circa 1988. These models feature the calibre 3075 which improved upon the ref. 1675’s movements with a higher vibrations per hour at 28,800, hacking seconds and quickset date function. This example features an 8.5M serial and dates to circa 1984. The case is polished. The hands have been relumed. The watc",Wind Vintage,2026-04-19,False
Rolex GMT-Master Reference 16700 w/ Black Insert Unpolished,Rolex,14900,https://www.windvintage.com/rolex-gmtmaster-reference-16700-w-black-insert,https://images.squarespace-cdn.com/content/v1/5b213f95506fbec9b54e014c/10459f52-f831-4ebb-b0b1-d878ccc42e46/DSC08711.JPG,"The Rolex GMT-Master ' video and read the corresponding article. You can also read our comprehensive article on the earlier reference ‘ Collector's Guide: The Rolex GMT-Master Reference 1675 In Steel ’. The watch does not come with box and papers. We do not know the service history, but it is running well. It recently passed a water resistance test of 5 bar. This watch is available at KITH Beverly",Wind Vintage,2026-04-19,False
Rolex GMT-Master Reference 16753 Unpolished,Rolex,19000,https://www.windvintage.com/rolex-gmt-master-reference-16753-unpolished,https://images.squarespace-cdn.com/content/v1/5b213f95506fbec9b54e014c/1766181389186-VFQCL3JT4LHCEYSQFPM2/Image+12.jpeg,The Rolex GMT-Master' video and corresponding article. It does not come with box and papers. It was just serviced and is running well. It recently passed a water resistance test of 5 bar. This watch will be available at the Kith Rodeo location.,Wind Vintage,2026-04-19,False
Rolex Red Submariner Ref. 1680 Unpolished,Rolex,26900,https://www.windvintage.com/rolex-red-submariner-ref-1680-unpolished,https://images.squarespace-cdn.com/content/v1/5b213f95506fbec9b54e014c/f7c06762-25be-4137-934b-0ce3d0e66320/DSC07833.JPG,The Rolex Submariner ’ video and corresponding article.,Wind Vintage,2026-04-19,False
Rolex Submariner Transitional Matte Dial Reference 16800,Rolex,10900,https://www.windvintage.com/rolex-submariner-transitional-matte-dial-reference-16800,https://images.squarespace-cdn.com/content/v1/5b213f95506fbec9b54e014c/1776450984247-F7B7X3K0N4956YWZXK4J/Image+29.jpeg,The Rolex Submariner is one of the most renowned sports watches of all time. This reference 168000 features a 7.1M serial number dating to circa 1982. The watch features the transitional matte dial and the tritium luminous material on the hour has taken a warm patina. It is paired on a Rolex reference 93150 Oyster bracelet with H date code dating to circa 1983. The case appears to have been lightl,Wind Vintage,2026-04-19,False
Rolex Transitional Matte Dial Submariner Reference 16800 Unpolished,Rolex,16000,https://www.windvintage.com/rolex-transitional-matte-dial-submariner-reference-16800-unpolished,https://images.squarespace-cdn.com/content/v1/5b213f95506fbec9b54e014c/1776457037736-OMA7YE0NGZWU4ZSJVXI8/Image+30.jpeg,"The Rolex Submariner is one of the most renowned sports watches of all time. This reference 16800 features a 7.4M serial number dating to circa 1983. The case appears to be well worn, but unpolished. The luminous material on the dial has a nice warm color. It is paired on a Rolex Oyster bracelet reference 93150 with G date code dating to circa 1982. To learn more about the Rolex Submariner, you ca",Wind Vintage,2026-04-19,False
Rolex Feet First Dial Submariner Reference 5512,Rolex,19900,http://windvintage.com/rolex-feet-first-dial-submariner-reference-5512-1,https://images.squarespace-cdn.com/content/v1/5b213f95506fbec9b54e014c/1776536950757-HR6U3SDFJ70M065P133P/Image+31.jpeg,"The Rolex Submariner Reference 5512 ’. To learn more about the Rolex Submariner, you can read my ‘Reference Points: Understanding The Rolex Submariner’ article and corresponding video . This watch does not come with box and papers. We do not know the service history, but it is running well! It recently passed a water resistance test of 5 bar.",Wind Vintage,2026-04-19,False
Rolex Submariner Ref. 1680 Unpolished,Rolex,13900,https://www.windvintage.com/rolex-submariner-ref-1680-1-,https://images.squarespace-cdn.com/content/v1/5b213f95506fbec9b54e014c/95c2ebb9-bf6b-441f-bdf7-8c4872049fa6/DSC06297.JPG,"The Rolex Submariner is one of the great sports watches and for great reason. This reference 1680 dates to circa 1978 with a 5.4M serial. The case appears to be unpolished. It is folded link Rolex bracelet with C date code dating to 1978 and is likely original to the watch. To learn more about the Rolex Submariner, you can watch my ‘ Reference Points: Understanding The Rolex Submariner ’ video and",Wind Vintage,2026-04-19,False
Rolex Submariner Reference 5513 w/ Box &amp; Receipt,Rolex,22900,https://www.windvintage.com/rolex-submariner-reference-5513-w/-box-receipt,https://images.squarespace-cdn.com/content/v1/5b213f95506fbec9b54e014c/1773850325875-8H20IGFFWXIJMTTRCT5H/Image+7.jpeg,"The Rolex Submariner Reference 5512 ’. To learn more about the Rolex Submariner, dive into my ‘ Reference Points: Understanding The Rolex Submariner ’ video and corresponding article. This watch comes with box and the original receipt. We do not know the service history, but it is running well.",Wind Vintage,2026-04-19,True
Rolex “Red Sub” Submariner Ref. 1680 Ghost Bezel,Rolex,21900,https://windvintage.com/rolex-red-sub-submariner-ref-1680-ghost-bezel,https://images.squarespace-cdn.com/content/v1/5b213f95506fbec9b54e014c/0db57c39-4f50-47f2-aa9e-3507ec412f98/DSC08419.JPG,The Rolex Submariner ’ video and corresponding article.,Wind Vintage,2026-04-19,True
Rolex Day-Date Green Ombre Roman Numeral Dial Ref 228238 in 18K YG Unpolished Full Set,Rolex,59900,https://windvintage.com/rolex-day-date-green-ombre-roman-numeral-dial-ref-228238-in-18k-yg-unpolished-full-set,https://images.squarespace-cdn.com/content/v1/5b213f95506fbec9b54e014c/78304afa-e286-4522-82a5-b8ccde39da34/DSC03607.JPG,The Rolex Day-Date is a luxurious watch. The green Ombre dial with Roman numerals are very sophisticated and rich. The watch is a reference 228238. It comes with full links. The case measures 40mm in diameter and is made of 18k yellow gold. The watch comes with box and papers and comes from the original owner. It was sold in 2025.,Wind Vintage,2026-04-19,True
Rolex Two-Tone GMT-Master II 116713LN Full Set,Rolex,12500,https://www.windvintage.com/rolex-gmt-master-ii-116713ln-full-set,https://images.squarespace-cdn.com/content/v1/5b213f95506fbec9b54e014c/1776348618919-0G7KDNWS4H18CLFGJPSM/Image+17.jpeg,"The Rolex GMT-Master II is one of the most sought-after models in the current Rolex lineup. The GMT-Master 116713LN denotes a steel and 18k yellow gold case and bracelet, as well as a black and gray rotating bezel. It captures the iconic DNA from the models created for Pan Am pilots in the 1950s. Due to its incredible heritage and iconic look, it remains a flagship model for Rolex to this day. The",Wind Vintage,2026-04-19,False
Rolex Submariner Ref. 5513 Gilt Dial,Rolex,19900,https://www.windvintage.com/rolex-submariner-ref-5513-gilt-dial,https://images.squarespace-cdn.com/content/v1/5b213f95506fbec9b54e014c/aee33326-d8dc-4794-a251-1a6aee0fe713/DSC08654.JPG,The Rolex Submariner is one of the most iconic sports watches and a model that represents the greatest attributes of the manufacturer. This example features a gilt dial with attractive tritium lume patina. This example has a 1.2M serial number dating the watch to circa 1966. The watch is paired on a folded link Rolex Oyster bracelet with 285 end links dating to 1971. The case has been lightly poli,Wind Vintage,2026-04-19,False
Rolex Kermit Submariner Ref 16610LV w/ RSC Card,Rolex,14900,https://www.windvintage.com/rolex-kermit-submariner-ref-16610lv-w/-rsc-card,https://images.squarespace-cdn.com/content/v1/5b213f95506fbec9b54e014c/104624e9-384d-48ef-87d4-04271984e3b5/DSC09415.JPG,The Rolex Submariner ’ video and corresponding article. The watch does not come with box and papers. It comes with a Rolex Service Center card and is under guarantee until September 2027.,Wind Vintage,2026-04-19,True
Rolex Silver Datejust Ref. 16014 Unpolished,Rolex,7900,https://windvintage.com/rolex-silver-datejust-ref-16014-unpolished,https://images.squarespace-cdn.com/content/v1/5b213f95506fbec9b54e014c/1776698004466-IUTZDIHSWVWZTV2KD0E7/DSC07250.png,The Simple Vintage Rolex Datejust In Steel ’. I’m constantly amazed by the quality and differentiations of the dials that Rolex used in vintage Datejusts over the decades. I have found the Rolex Datejust to be one of the most versatile watches a person can have. This Datejust features a silver “soleil” dial. This watch dates back to 1979 with a 5.8M serial. It measures 36mm in diameter. The Rolex ,Wind Vintage,2026-04-19,False
Rolex Linen Oyster Precision Reference 6426 Unpolished,Rolex,4900,https://www.windvintage.com/rolex-linen-oyster-precision-reference-6426-unpolished,https://images.squarespace-cdn.com/content/v1/5b213f95506fbec9b54e014c/1776441378362-WYUEB5IGWDUZGYUI6ZZ0/Image+23.jpeg,,Wind Vintage,2026-04-19,True
Patek Philippe Reference 5146G-010 w/ Service Receipts and Extract,Patek Philippe,25000,https://www.windvintage.com/patek-philippe-reference-5146g-010-w/-service-receipts-and-extract,https://images.squarespace-cdn.com/content/v1/5b213f95506fbec9b54e014c/8130ba04-4217-4442-8293-6f48210fff7a/DSC03797.JPG,The Patek Philippe reference 5146G-010 is an awesome annual calendar model. The model is now discontinued. This particular example is a beautiful 18K white gold case. The case measures 39mm in diameter. It features a beautiful grey dial. It is paired on a brand new Patek Philippe strap. The watch does not come with a box or papers. It does come with service receipts from Patek Philippe dating to 2,Wind Vintage,2026-04-19,True
Patek Philippe Cloisonné Enamel World Time Ref 5231J-001 in 18k YG Unpolished Full Set Like New,Patek Philippe,107500,https://www.windvintage.com/patek-philippe-cloisonn-enamel-world-time-reference-5231j-001-in-18k-yg-unpolished-full-set,https://images.squarespace-cdn.com/content/v1/5b213f95506fbec9b54e014c/3b3b2c2b-001b-4866-adf3-32b997407933/DSC01966.JPG,,Wind Vintage,2026-04-19,True
Patek Philippe 5905P-001 in Platinum with Box and Pouch Unpolished,Patek Philippe,59000,https://www.windvintage.com/patek-philippe-5905p-001-in-platinum-with-box-and-pouch-,https://images.squarespace-cdn.com/content/v1/5b213f95506fbec9b54e014c/5fd6c821-b4a1-4a63-bd0c-578e677d123b/DSC07317.JPG,The Patek Philippe reference 5905P-001 is a very special self-winding annual calendar flyback chronograph. The platinum case measures 42mm in diameter. We believe the case is unpolished. It is paired on a beautiful Patek Philippe strap and platinum deployant. It has a stunning blue dial. The case is 40mm in diameter. The watch is powered by the calibre CH 28‑520 QA 24H. This watch retailed for ove,Wind Vintage,2026-04-19,False
"Patek Philippe Reference 2526 in 18K YG w/ Extract, Box &amp; Service Box/Papers",Patek Philippe,45000,https://www.windvintage.com/patek-philippe-reference-2526-in-18k-yg-w/-extract-box-service-box/papers,https://images.squarespace-cdn.com/content/v1/5b213f95506fbec9b54e014c/ccfe17cc-2f26-47ed-af2b-5108ebfca773/DSC02253.JPG,The Patek Philippe reference 2526 is an iconic watch and this is an incredibly attractive example in 18K yellow gold. The Patek Philippe Reference 2526 is renowned as the most attractive important of Patek Philippe’s automatic references. The watch dates to 1956 and was sold in the 1957 according to the Extract from the Archives. The case has been polished. The dial is very beautiful. The 2 o’cloc,Wind Vintage,2026-04-19,True
A. Lange &amp; Söhne Saxonia Jubiläums Langematik Ref. 302.025 in Platinum Full Set,A. Lange,55000,https://www.windvintage.com/a-lange-shne-saxonia-jubilums-langematik-ref-302025-in-platinum-full-set,https://images.squarespace-cdn.com/content/v1/5b213f95506fbec9b54e014c/5dd74bc0-72dd-42d9-ae63-9388249d1275/DSC02020.JPG,,Wind Vintage,2026-04-19,False
A. Lange &amp; Söhne Meter Dial Datograph Ref 403.035 in Platinum Full Set,A. Lange,89000,https://www.windvintage.com/a-lange-shne-meter-dial-datograph-ref-403035-in-platinum-full-set,https://images.squarespace-cdn.com/content/v1/5b213f95506fbec9b54e014c/031820a7-372c-4063-9ff5-dc461ae8de45/DSC01774.JPG,,Wind Vintage,2026-04-19,False
A. Lange &amp; Söhne Lange 1 Reference 101.031 18K Rose Gold w/ Certificate,A. Lange,26900,https://www.windvintage.com/a-lange-shne-lange-1-reference-101031-18k-rose-gold-w/-extract,https://images.squarespace-cdn.com/content/v1/5b213f95506fbec9b54e014c/1776172405806-FRUHQA8Y1UOY8B163QLC/Image+12.jpeg,,Wind Vintage,2026-04-19,False
Movado Breguet Numerals M95 Chronograph Unpolished,Movado,13500,https://www.windvintage.com/movado-breguet-numerals-chronograph-unpolished,https://images.squarespace-cdn.com/content/v1/5b213f95506fbec9b54e014c/d960c114-4ce0-46ce-ac04-10c235468479/DSC07232.JPG,,Wind Vintage,2026-04-19,False
Abercrombie &amp; Fitch Seafarer Ref 2443 Unpolished,Other,29000,https://windvintage.com/abercrombie-fitch-seafarer-ref-2443-unpolished,https://images.squarespace-cdn.com/content/v1/5b213f95506fbec9b54e014c/64224a61-b1c7-4db9-85af-d22b8294b94f/DSC03725.JPG,,Wind Vintage,2026-04-19,False
Heuer Monaco Reference 1133G Unpolished,Heuer,14900,https://www.windvintage.com/heuer-monaco-reference-1133g-unpolished,https://images.squarespace-cdn.com/content/v1/5b213f95506fbec9b54e014c/1776892161540-82JQDRLZQVRW4GHQXIXZ/Image+52.jpeg,"The Heuer Monaco was introduced in 1969 with the first automatic chronograph movement, the calibre 11. Coupled by the association of Steve McQueen’s decision to wear the watch in the film ‘Le Mans’, the watch is nothing short of iconic. This is a very attractive reference 1133G with the rare all grey metallic dial. Most are grey with black registers. We believe the case is unpolished. The dial is ",Wind Vintage,2026-04-19,False
Heuer Carrera 1153 Test Dial,Heuer,6900,https://www.windvintage.com/heuer-carrera-1153-test-dial,https://images.squarespace-cdn.com/content/v1/5b213f95506fbec9b54e014c/44deb7bf-7547-46a0-b1e3-4c4db8553ff7/DSC03577.JPG,,Wind Vintage,2026-04-19,False
Heuer Monaco ref. 1133 Paintless Wonder Dial,Heuer,19000,https://www.windvintage.com/heuer-monaco-ref-1133-paintless-wonder-dial,https://images.squarespace-cdn.com/content/v1/5b213f95506fbec9b54e014c/6386bede-d028-4798-937d-bedbeb34b797/DSC05021.JPG,"The Heuer Monaco was introduced in 1969 with the first automatic chronograph movement, the calibre 11. Coupled by the association of Steve McQueen’s decision to wear the watch in the film ‘Le Mans’, the watch is nothing short of iconic. This example has taken a fascinating transitional metallic dial referred to as the Paintless Dial. The stainless steel case measures approximately 38x40mm. It is p",Wind Vintage,2026-04-19,False
Heuer Autavia Ref 2446C Unpolished,Heuer,9900,https://windvintage.com/heuer-autavia-ref-2446c-unpolished,https://images.squarespace-cdn.com/content/v1/5b213f95506fbec9b54e014c/1776434087854-2T75JZ5H17BDIOHT4QNU/Image+21.jpeg,,Wind Vintage,2026-04-19,False
Czapek Frozen Star Osmium Dial Limited Edition Full Set Unpolished,Czapek,65000,https://www.windvintage.com/czapek-frozen-star-osmium-dial-limited-edition-full-set-unpolished,https://images.squarespace-cdn.com/content/v1/5b213f95506fbec9b54e014c/3d255b5e-a6b2-4e53-ae18-3b71af0ceba2/DSC00488.JPG,,Wind Vintage,2026-04-19,False
Aquastar Deepstar Big Eye Mk 4 Chronograph Mint Condition,Aquastar,9000,https://www.windvintage.com/aquastar-deepstar-chronograph-mint-condition,https://images.squarespace-cdn.com/content/v1/5b213f95506fbec9b54e014c/5939edec-f9e8-4d5a-9dc6-b0a567c466ab/DSC01540.JPG,,Wind Vintage,2026-04-19,False
Ebel 1911 Chronograph Ref. 8134901 Blue Dial 18k Yellow Gold,Other,8500,https://www.windvintage.com/ebel-1911-chronograph-ref-8134901-blue-dial-18k-yellow-gold,https://images.squarespace-cdn.com/content/v1/5b213f95506fbec9b54e014c/b23c373a-4ae4-458a-8da1-08208730d53d/DSC09322.JPG,,Wind Vintage,2026-04-19,False
Audemars Piguet Edward Piguet Tourbillon 25819PT/O/0002/01 Box &amp; Papers,Audemars Piguet,46900,https://www.windvintage.com/audemars-piguet-edward-piguet-tourbillon-25819pt/o/0002/01-box-papers,https://images.squarespace-cdn.com/content/v1/5b213f95506fbec9b54e014c/2a4bd632-db45-4c7b-8bd3-9c7722490d96/DSC02373.JPG,,Wind Vintage,2026-04-19,True
Audemars Piguet Royal Oak C Series Ref 5402ST w/ Box,Audemars Piguet,64000,https://windvintage.com/audemars-piguet-royal-oak-c-series-ref-5402st-w/-box,https://images.squarespace-cdn.com/content/v1/5b213f95506fbec9b54e014c/05fa144a-c606-49b3-89ab-bb0bc36cdb8a/DSC03729.JPG,"The Audemars Piguet Royal Oak is an icon. It is the original luxury sports watch that created and defined the category. Introduced at BaselWorld in 1972 after being designed by Gérald Genta, it turned the Swiss industry upside down and changed the fortunes of the struggling Audemars Piguet. It’s no surprise, that Patek Philippe hired Gerald Genta a few years later to introduce their own version of",Wind Vintage,2026-04-19,False
