title,brand,price,url,img,description,source,date,sold
Patek Philippe Tank Style Watch w/ Breguet Numerals in 18K White Gold,Patek Philippe,19000,https://www.windvintage.com/patek-philippe-tank-watch-w/-breguet-numerals-in-18k-white-gold,https://images.squarespace-cdn.com/content/v1/5b213f95506fbec9b54e014c/91a968da-1c2d-433a-8a14-d3eb17800e36/DSC06051.JPG,,Wind Vintage,2026-04-19,True
Rolex Submariner Reference 126610LN Unpolished Box &amp; Papers,Rolex,13500,https://www.windvintage.com/rolex-submariner-reference-126610ln-unpolished-box-papers,https://images.squarespace-cdn.com/content/v1/5b213f95506fbec9b54e014c/1ce86abe-4ad6-4d4f-a822-84f71adf94af/DSC04177.JPG,"The Rolex Submariner is one of the most versatile and adorned wristwatches. This particular example was purchased in 2022. The case measures 41mm in diameter. It appears to be unpolished. To learn more about the Rolex Submariner, you can watch my ‘ Reference Points: Understanding The Rolex Submariner ’ video and read the corresponding article. The watch comes “full set” with box and papers. We do ",Wind Vintage,2026-04-19,True
Rolex Coke GMT-Master Ref 16700 Unpolished,Rolex,15900,https://www.windvintage.com/rolex-coke-gmt-master-ref-16700-unpolished,https://images.squarespace-cdn.com/content/v1/5b213f95506fbec9b54e014c/a37223ba-59f0-4f87-b902-752b83012d78/DSC07645.JPG,The Rolex GMT-Master ' video and read the corresponding article.,Wind Vintage,2026-04-19,True
Vulcain Cricket Mirror Track Reference S2328A Unpolished,Other,5900,https://www.windvintage.com/vulcain-cricket-mirror-track-reference-s2328a-unpolished,https://images.squarespace-cdn.com/content/v1/5b213f95506fbec9b54e014c/e68733a0-847e-4267-a0d8-009640e93ad0/DSC07586.JPG,,Wind Vintage,2026-04-19,True
Rolex Explorer 1016 Frog Foot Mk 1 Dial Unpolished,Rolex,22000,https://www.windvintage.com/rolex-explorer-1016-frog-foot-mk-1-dial-unpolished,https://images.squarespace-cdn.com/content/v1/5b213f95506fbec9b54e014c/655b0075-cc93-4a6c-9668-3fc8feb8feef/DSC02908.JPG,,Wind Vintage,2026-04-19,True
Heuer Camaro Exotic Racing Dial Ref 7743 NT Unpolished,Heuer,6900,https://windvintage.com/heuer-camaro-exotic-racing-dial-ref-7743-nt-unpolished,https://images.squarespace-cdn.com/content/v1/5b213f95506fbec9b54e014c/e4692169-6753-46cd-b803-c4e52e310867/DSC02952.JPG,"The Camaro line has always been a sleeper when compared to the more discussed siblings such as the Autavia and Carrera. This particular reference 7743 NT has an awesome dark brown “exotic racing” dial. The radial finished bezel is always a highlight within unpolished exampled such as this. The watch is powered by the Valjoux 7730, a formidable bi-register chronograph that has stood the test of tim",Wind Vintage,2026-04-19,True
Behrens Inventor BHR030 Full Set Like New Stickered,Other,7000,https://www.windvintage.com/behrens-inventor-bhr030-full-set-unpolished,https://images.squarespace-cdn.com/content/v1/5b213f95506fbec9b54e014c/1775102848474-GZII4USCJW5TXI09ZTVZ/Image+8.jpeg,,Wind Vintage,2026-04-19,True
Rolex MK II “Red Sub” Submariner Reference 1680,Rolex,24900,https://www.windvintage.com/rolex-red-sub-submariner-reference-1680,https://images.squarespace-cdn.com/content/v1/5b213f95506fbec9b54e014c/1776710480764-E191EBQN9TJRWEBZBACG/Image+34.jpeg,"The Patent Pending extension is worth thousands of dollars by itself, but does not appear to be original to the bracelet as it should likely be on an early bracelet with removable 280 end links and this has integrated 380 end links. The dial is an attractive example with slightly tropical color. It features Submariner in red writing along with tritium luminous plots that have turned warm with pati",Wind Vintage,2026-04-19,True
Dunhill Jaeger-LeCoultre Memovox Reference E 855 W/ Papers,Jaeger-LeCoultre,12900,https://www.windvintage.com/dunhill-jaeger-lecoultre-memovox-reference-e-855-w/-papers,https://images.squarespace-cdn.com/content/v1/5b213f95506fbec9b54e014c/1776791293293-UPBXJUYWIW5KB80DLHIT/Image+48.jpeg,,Wind Vintage,2026-04-19,True
Heuer Carrera Reference 2447S 2nd Execution Unpolished,Heuer,9900,https://www.windvintage.com/heuer-carrera-2nd-execution-reference-2447s-unpolished,https://images.squarespace-cdn.com/content/v1/5b213f95506fbec9b54e014c/1776790291206-WGZ46WLYNN06BF5M8MFH/Image+47.jpeg,,Wind Vintage,2026-04-19,True
Heuer USS Whale Carrera Reference 2447S Eggshell Dial,Heuer,19000,https://www.windvintage.com/heuer-white-whale-carrera-reference-2447s-eggshell-dial,https://images.squarespace-cdn.com/content/v1/5b213f95506fbec9b54e014c/1776862945772-7S05DLHS12L7G5BLZP71/Image+50.jpeg,"The Spear Foundation allowed the shipmate to pick out his own watch from Mallove’s Jewelers in Groton, Connecticut. Brooks wisely selected a Carrera chronograph, but there was a catch. Navy regulations restricted external radioactive sources aboard nuclear-powered boats, so as to ensure accurate monitoring of radiation levels from propulsion systems. This watch had its tritium luminous material re",Wind Vintage,2026-04-19,True
Rolex Gilt Dial GMT-Master Ref 1675 Unpolished,Rolex,39000,https://www.windvintage.com/rolex-gilt-dial-gmt-master-ref-1675-unpolished,https://images.squarespace-cdn.com/content/v1/5b213f95506fbec9b54e014c/d0435f3a-8633-48c3-918f-bcdff4704e8f/DSC07876.JPG,"The Rolex GMT-Master was originally designed for Pan Am pilots in the 1950s and continues to be a flagship model for Rolex to this day. The reference 1675 was introduced in 1959 and remained in production until 1980. This is an awesome Rolex GMT-Master reference 1675. The gilt dial has some minor scratches, but it is incredibly attractive. The case appears to be unpolished. The aluminum bezel inse",Wind Vintage,2026-04-19,True
Rolex Exclamation Gilt Dial Explorer Ref 1016,Rolex,24900,https://www.windvintage.com/rolex-exclamation-gilt-dial-explorer-ref-1016,https://images.squarespace-cdn.com/content/v1/5b213f95506fbec9b54e014c/e045e68a-8fe3-4ae3-af42-530166645c0d/DSC07775.JPG,"The Rolex Explorer reference 1016 is an icon of simplicity and function. The Explorer reference 1016 was produced from 1960 until circa 1989 and it was the first Explorer with “Superlative Chronometer Officially Certified"" on the dial. The 1016 is one of the purest expressions of watch design and I am asked for great vintage Explorer reference 1016 examples more than any other watch. This example ",Wind Vintage,2026-04-19,True
Rolex Grey Dial Datejust Reference 1601 Unpolished,Rolex,8900,https://www.windvintage.com/rolex-grey-dial-datejust-reference-1601-unpolished1111,https://images.squarespace-cdn.com/content/v1/5b213f95506fbec9b54e014c/1773774027481-P769S9F13NSSQ8HF7WLJ/Image+1.jpeg,The Simple Vintage Rolex Datejust In Steel ’. I’m constantly amazed by the quality and differentiations of the dials that Rolex used in vintage Datejusts over the decades. I have found the Rolex Datejust to be one of the most versatile watches a person can have and the simplicity in this grey-dial reference 1601 is so beautiful. The watch features a 2.89M serial dates to circa 1972. The case measu,Wind Vintage,2026-04-19,False
Rolex 14K Two-Tone Datejust 16013 Unpolished,Rolex,7900,https://www.windvintage.com/rolex-14k-two-tone-datejust-16013-unpolished,https://images.squarespace-cdn.com/content/v1/5b213f95506fbec9b54e014c/1773774164796-O33PQXGUFOZF6NFAI66M/Image.jpg,,Wind Vintage,2026-04-19,False
Rolex Ladies Oyster Perpetual Reference 76080 Unpolished,Rolex,4900,https://www.windvintage.com/rolex-ladies-oyster-perpetual-reference-76080-unpolished,https://images.squarespace-cdn.com/content/v1/5b213f95506fbec9b54e014c/1773774071856-BEEJYYCFRG1L6S0VVO3L/Image+4.jpeg,,Wind Vintage,2026-04-19,False
Rolex Ladies Oyster Perpetual Ref. 6618 Unpolished,Rolex,4900,https://www.windvintage.com/rolex-ladies-oyster-perpetual-ref-6618-unpolished,https://images.squarespace-cdn.com/content/v1/5b213f95506fbec9b54e014c/1773774077564-Z1IY8GDW6J6AF7B0GFQP/Image+3.jpeg,,Wind Vintage,2026-04-19,False
18mm Rolex C&amp;I Straight End Rivet Stretch 6.2 inch 1973,Rolex,2900,https://www.windvintage.com/18mm-rolex-ci-straight-end-rivet-stretch-62-inch-1973,https://images.squarespace-cdn.com/content/v1/5b213f95506fbec9b54e014c/1710950946931-63Z0R8CDBDL48Q9DUESE/DSC09492.jpeg,,Wind Vintage,2026-04-19,False
Rolex 78350 Solid Link Swiss 6.2 Inches w/ 1 end link 557 B 1979,Rolex,1900,https://www.windvintage.com/rolex-78350-solid-link-swiss-62-inches-w/-1-end-link-557-b-1979,https://images.squarespace-cdn.com/content/v1/5b213f95506fbec9b54e014c/1711649024166-K7B39NJQMQ7OEWDYY7MM/DSC08511.jpeg,,Wind Vintage,2026-04-19,False
Rolex 78350 Solid Link Swiss 6.2 Inches w/ 1 end link 557 B 1979,Rolex,1500,https://www.windvintage.com/rolex-78350-solid-link-swiss-66-inch-w/-1-end-link-557-circa-2011-,https://images.squarespace-cdn.com/content/v1/5b213f95506fbec9b54e014c/1711651449891-6O6QUHHJ20XBOM8Q047J/DSC08519.jpeg,,Wind Vintage,2026-04-19,True
19mm Rolex 6635 Stretch Rivet 6.25 Inches 1956,Rolex,2900,https://www.windvintage.com/19mm-rolex-rivet-6635-stretch-rivet-625-inches-1956,https://images.squarespace-cdn.com/content/v1/5b213f95506fbec9b54e014c/044d9fef-3b0e-45c0-9585-ae99ca6679cd/DSC02550.JPG,,Wind Vintage,2026-04-19,False
